A1: Sermons Series by Pastor Jason Lim
A2: Links clickable to exact sermon on gospellight.sg with transcripts
A3: Ekklesia
A4: 1 | B4: Acts 2:42-47 | C4: Ekklesia - Vision | D4: 42736
A5: 2 | B5: Mark 2:1-12 | C5: Ekklesia - Mission | D5: 42743
A6: 3 | B6: 1 Corinthians 2:2 | C6: Ekklesia - Message | D6: =D5+7 -> 42750
A7: 4 | B7: 1 John 5:12 | C7: Ekklesia - Knowing | D7: =D6+7 -> 42757
A8: 5 | B8: 2Corinthians 3:18 | C8: Ekklesia - Growing | D8: =D7+7 -> 42764
A9: 6 | B9: John 15:1-8 | C9: Ekklesia - Going | D9: =D8+7 -> 42771
A10: 7 | B10: John 13:34-35 | C10: Ekklesia - Rooted in the local church | D10: =D9+7 -> 42778